{
 "version": 1,
 "generatedAt": "2026-10-15T15:41:23Z",
 "pipeline": "scripts/safety/build_cards.py v1 code 381d2b39ae90",
 "engine": {
  "name": "Stockfish 19",
  "nodes": 1000000,
  "multipv": 5,
  "threads": 1,
  "hashMb": 64,
  "freshHashEachSearch": true,
  "measurementNodes": 250000,
  "lineNodes": 250000,
  "extendNodes": 250000
 },
 "source": "Test fixture: 6 cards copied unchanged from public/data/safety/cards.json of 2026-10-17 (built from Lichess games of abustrup: 31 rated games (31 blitz), 2026-10-10 to 2026-10-15)",
 "counts": {
  "own": 3,
  "held": 2,
  "quiet": 1
 },
 "cards": [
  {
   "id": "held:uUCQ83zH:23",
   "kind": "held",
   "cls": "held",
   "fenBefore": "r4rk1/ppp2ppp/2nqpn2/3pN3/3P1P2/2PQ4/PP1N1PPP/R4RK1 b - - 4 11",
   "lastMove": "c6e5",
   "lastMoveSan": "Nxe5",
   "side": "white",
   "phase": "opening",
   "facingThreat": true,
   "nothingToWin": false,
   "wasWinning": true,
   "winBefore": 91.5,
   "top": [
    {
     "uci": "f4e5",
     "san": "fxe5",
     "win": 91.2,
     "eval": {
      "cp": 635
     },
     "pv": [
      "f4e5",
      "d6e7",
      "e5f6",
      "e7f6",
      "d3e2",
      "b7b6"
     ]
    },
    {
     "uci": "d4e5",
     "san": "dxe5",
     "win": 90.68,
     "eval": {
      "cp": 618
     },
     "pv": [
      "d4e5",
      "d6a6",
      "d3a6",
      "b7a6",
      "e5f6",
      "g7f6"
     ]
    },
    {
     "uci": "d3g3",
     "san": "Qg3",
     "win": 6.71,
     "eval": {
      "cp": -715
     },
     "pv": [
      "d3g3",
      "e5g6",
      "f4f5",
      "g6f4",
      "g1h1",
      "e6f5"
     ]
    },
    {
     "uci": "d3e2",
     "san": "Qe2",
     "win": 6.35,
     "eval": {
      "cp": -731
     },
     "pv": [
      "d3e2",
      "e5c6",
      "g2g3",
      "c6e7",
      "d2f3",
      "e7f5"
     ]
    },
    {
     "uci": "d3e3",
     "san": "Qe3",
     "win": 5.99,
     "eval": {
      "cp": -748
     },
     "pv": [
      "d3e3",
      "e5g4",
      "e3g3",
      "d6d8",
      "d2b3",
      "g4h6"
     ]
    }
   ],
   "topComplete": true,
   "human": {
    "uci": "f4e5",
    "san": "fxe5",
    "win": 91.2,
    "eval": {
     "cp": 635
    },
    "passes": true,
    "judgment": null,
    "lichessJudgment": null,
    "drop": 0.1
   },
   "threat": {
    "loss": 89.7,
    "material": 10,
    "mateIn": null,
    "real": true,
    "line": [
     "e5d3",
     "g2g3",
     "d3b2",
     "f1b1",
     "b2c4",
     "d2c4"
    ],
    "lineSan": [
     "Nxd3",
     "g3",
     "Nxb2",
     "Rfb1",
     "Nc4",
     "Nxc4"
    ]
   },
   "facts": [
    {
     "t": "threat",
     "reply": "Nxd3",
     "line": [
      "e5d3",
      "g2g3",
      "d3b2",
      "f1b1",
      "b2c4",
      "d2c4",
      "d5c4",
      "b1b7",
      "f6d5"
     ],
     "lineSan": [
      "Nxd3",
      "g3",
      "Nxb2",
      "Rfb1",
      "Nc4",
      "Nxc4",
      "dxc4",
      "Rxb7",
      "Nd5"
     ],
     "gain": 9,
     "wins": {
      "piece": "q",
      "square": "d3"
     }
    }
   ],
   "context": {
    "gameId": "uUCQ83zH",
    "date": "2026-10-10",
    "tc": "180+2",
    "speed": "blitz",
    "rated": true,
    "moveNumber": 12,
    "clockMs": 161630,
    "spentMs": 1680
   },
   "moves": [
    {
     "uci": "a1b1",
     "eval": {
      "cp": -1097
     },
     "line": [
      "a1b1",
      "e5d3",
      "g2g3",
      "d3f4",
      "a2a3",
      "f6h5"
     ],
     "gain": 10,
     "safe": false
    },
    {
     "uci": "a1c1",
     "eval": {
      "cp": -1114
     },
     "line": [
      "a1c1",
      "e5d3",
      "c1b1",
      "d3f4",
      "g2g3",
      "f4d3"
     ],
     "gain": 10,
     "safe": false
    },
    {
     "uci": "a1d1",
     "eval": {
      "cp": -1141
     },
     "line": [
      "a1d1",
      "e5d3",
      "g2g3",
      "d3b2",
      "d1b1",
      "b2a4"
     ],
     "gain": 10,
     "safe": false
    },
    {
     "uci": "a1e1",
     "eval": {
      "cp": -1113
     },
     "line": [
      "a1e1",
      "e5d3",
      "e1e3",
      "d3b2",
      "f1b1",
      "b2a4"
     ],
     "gain": 10,
     "safe": false
    },
    {
     "uci": "a2a3",
     "eval": {
      "cp": -1128
     },
     "line": [
      "a2a3",
      "e5d3",
      "g2g3",
      "f6e4",
      "d2f3",
      "d3b2",
      "f1b1"
     ],
     "gain": 10,
     "safe": false
    },
    {
     "uci": "a2a4",
     "eval": {
      "cp": -1114
     },
     "line": [
      "a2a4",
      "e5d3",
      "g2g3",
      "f6h5",
      "d2f3",
      "h5f4",
      "g3f4",
      "d3f4",
      "a1e1"
     ],
     "gain": 8,
     "safe": false
    },
    {
     "uci": "b2b3",
     "eval": {
      "cp": -1110
     },
     "line": [
      "b2b3",
      "e5d3",
      "g2g3",
      "f6h5",
      "f4f5",
      "e6f5",
      "d2f3"
     ],
     "gain": 10,
     "safe": false
    },
    {
     "uci": "b2b4",
     "eval": {
      "cp": -1123
     },
     "line": [
      "b2b4",
      "e5d3",
      "g2g3",
      "d3f4",
      "f1e1",
      "f4g6"
     ],
     "gain": 10,
     "safe": false
    },
    {
     "uci": "c3c4",
     "eval": {
      "cp": -1131
     },
     "line": [
      "c3c4",
      "e5d3",
      "g2g3",
      "c7c5",
      "d4c5",
      "d6b8"
     ],
     "gain": 8,
     "safe": false
    },
    {
     "uci": "d2b1",
     "eval": {
      "cp": -1160
     },
     "line": [
      "d2b1",
      "e5d3",
      "b1d2",
      "d3b2",
      "f1b1",
      "b2a4"
     ],
     "gain": 10,
     "safe": false
    },
    {
     "uci": "d2b3",
     "eval": {
      "cp": -1113
     },
     "line": [
      "d2b3",
      "e5d3",
      "g2g3",
      "d3b2",
      "f1b1",
      "b2c4"
     ],
     "gain": 10,
     "safe": false
    },
    {
     "uci": "d2c4",
     "eval": {
      "cp": -919
     },
     "line": [
      "d2c4",
      "e5c4",
      "b2b3",
      "c4a3",
      "c3c4",
      "d6b4"
     ],
     "gain": 3,
     "safe": false
    },
    {
     "uci": "d2e4",
     "eval": {
      "cp": -893
     },
     "line": [
      "d2e4",
      "e5d3",
      "e4d6",
      "c7d6",
      "f4f5",
      "f8b8"
     ],
     "gain": 3,
     "safe": false
    },
    {
     "uci": "d2f3",
     "eval": {
      "cp": -1074
     },
     "line": [
      "d2f3",
      "e5d3",
      "f3e5",
      "d3b2",
      "a1b1",
      "b2c4"
     ],
     "gain": 10,
     "safe": false
    },
    {
     "uci": "d3a6",
     "eval": {
      "cp": -924
     },
     "line": [
      "d3a6",
      "e5f3",
      "d2f3",
      "b7a6",
      "g2g3",
      "f6h5"
     ],
     "gain": 6,
     "safe": false
    },
    {
     "uci": "d3b1",
     "eval": {
      "cp": -753
     },
     "line": [
      "d3b1",
      "e5c6",
      "g2g3",
      "f8c8",
      "b1d1",
      "c6e7"
     ],
     "gain": 0,
     "safe": false
    },
    {
     "uci": "d3b5",
     "eval": {
      "cp": -756
     },
     "line": [
      "d3b5",
      "e5g6",
      "d2f3",
      "f8b8",
      "b5e2",
      "d6f4",
      "f3e5"
     ],
     "gain": 1,
     "safe": false
    },
    {
     "uci": "d3c2",
     "eval": {
      "cp": -747
     },
     "line": [
      "d3c2",
      "e5c6",
      "g2g3",
      "f8b8",
      "a1e1",
      "a7a5"
     ],
     "gain": 0,
     "safe": false
    },
    {
     "uci": "d3c4",
     "eval": {
      "cp": -1111
     },
     "line": [
      "d3c4",
      "e5c4",
      "d2f3",
      "f8b8",
      "f4f5",
      "b7b5"
     ],
     "gain": 9,
     "safe": false
    },
    {
     "uci": "d3e2",
     "eval": {
      "cp": -731
     },
     "line": [
      "d3e2",
      "e5c6",
      "g2g3",
      "c6e7",
      "d2f3",
      "e7f5"
     ],
     "gain": 0,
     "safe": false
    },
    {
     "uci": "d3e3",
     "eval": {
      "cp": -748
     },
     "line": [
      "d3e3",
      "e5g4",
      "e3g3",
      "d6d8",
      "d2b3",
      "g4h6"
     ],
     "gain": 0,
     "safe": false
    },
    {
     "uci": "d3e4",
     "eval": {
      "cp": -889
     },
     "line": [
      "d3e4",
      "f6e4",
      "f4e5",
      "d6c6",
      "d2b3",
      "h7h5"
     ],
     "gain": 6,
     "safe": false
    },
    {
     "uci": "d3f3",
     "eval": {
      "cp": -967
     },
     "line": [
      "d3f3",
      "e5f3",
      "d2f3",
      "f6h5",
      "f3e5",
      "h5f4",
      "g2g3"
     ],
     "gain": 7,
     "safe": false
    },
    {
     "uci": "d3f5",
     "eval": {
      "cp": -970
     },
     "line": [
      "d3f5",
      "e5f3",
      "d2f3",
      "e6f5",
      "f3e5",
      "f8c8"
     ],
     "gain": 6,
     "safe": false
    },
    {
     "uci": "d3g3",
     "eval": {
      "cp": -715
     },
     "line": [
      "d3g3",
      "e5g6",
      "f4f5",
      "g6f4",
      "g1h1",
      "e6f5",
      "c3c4"
     ],
     "gain": 1,
     "safe": false
    },
    {
     "uci": "d3g6",
     "eval": {
      "cp": -1084
     },
     "line": [
      "d3g6",
      "e5g6",
      "d2b3",
      "g6f4",
      "a1e1",
      "g7g6"
     ],
     "gain": 10,
     "safe": false
    },
    {
     "uci": "d3h3",
     "eval": {
      "cp": -749
     },
     "line": [
      "d3h3",
      "e5g6",
      "g2g3",
      "f8e8",
      "d2f3",
      "g6f8"
     ],
     "gain": 0,
     "safe": false
    },
    {
     "uci": "d3h7",
     "eval": {
      "cp": -862
     },
     "line": [
      "d3h7",
      "f6h7",
      "f4e5",
      "d6b6",
      "f2f4",
      "f8c8"
     ],
     "gain": 5,
     "safe": false
    },
    {
     "uci": "d4e5",
     "eval": {
      "cp": 618
     }
    },
    {
     "uci": "f1b1",
     "eval": {
      "cp": -1147
     },
     "line": [
      "f1b1",
      "e5d3",
      "g2g3",
      "d3f4",
      "d2b3",
      "f6h5"
     ],
     "gain": 10,
     "safe": false
    },
    {
     "uci": "f1c1",
     "eval": {
      "cp": -1138
     },
     "line": [
      "f1c1",
      "e5d3",
      "c1c2",
      "d3f4",
      "g2g3",
      "f4h3",
      "g1g2"
     ],
     "gain": 10,
     "safe": false
    },
    {
     "uci": "f1d1",
     "eval": {
      "cp": -1135
     },
     "line": [
      "f1d1",
      "e5d3",
      "g2g3",
      "d3f4",
      "g3f4",